{"schema":1,"slug":"github-pull-requests","title":"PRs & branches","purpose":"Open pull request status and non-main branches with commits ahead of main, with independent freshness and scan coverage.","kit_api":1,"sizes":["md","tall","lg","wide"],"feeds":[{"id":"agent.github-pull-requests","history":0},{"id":"agent.github-branches","history":0}],"settings":{"type":"object","properties":{},"additionalProperties":false}}