{"schema":1,"slug":"open-pull-requests","title":"Open pull requests","purpose":"Open PRs by repository, with draft state, submitted review summaries, CI, conflicts and freshness.","kit_api":1,"sizes":["tall","lg","wide"],"feeds":[{"id":"agent.github-pull-requests","history":0}],"settings":{"type":"object","properties":{},"additionalProperties":false}}